{
  "assets": [
    {
      "alpha_processing": "not-applicable",
      "audit": {
        "checks": [
          "palette",
          "clear stable gravity",
          "no text or UI",
          "readable depth"
        ],
        "conclusion": "approved-concept-candidate"
      },
      "id": "saga.outer-day-city.pre-rotation",
      "kind": "environment",
      "location_id": "saga.outer-day-city",
      "prohibited_integration_reason": "Concept composition only; requires pixel-grid reconstruction and engine asset acceptance.",
      "prompt": "Saga Outer Day City before rotation; dark industrial cosmic pixel concept, stable gravity and daylight shell city.",
      "purpose": "轮坠前外昼城空间、承重结构与稳定重力方向基准。",
      "source_path": "project_reference/坠星余烬_当前设定与素材_2026-07-26/素材/萨迦/概念候选/区域/saga_outer_day_city_pre_rotation_v01.png",
      "status": "concept-candidate",
      "target_size": {
        "concept_aspect": "16:9 concept; not tileable",
        "height": 90,
        "width": 160
      },
      "variants": [
        "pre-rotation",
        "during-rotation",
        "post-rotation"
      ]
    },
    {
      "alpha_processing": "not-applicable",
      "audit": {
        "checks": [
          "palette",
          "inward gravity",
          "no text or UI",
          "readable water volume"
        ],
        "conclusion": "approved-concept-candidate"
      },
      "id": "saga.inner-sea-dome.pre-rotation",
      "kind": "environment",
      "location_id": "saga.inner-sea-dome",
      "prohibited_integration_reason": "Concept composition only; requires pixel-grid reconstruction and engine asset acceptance.",
      "prompt": "Saga Inner Sea Dome before rotation; concave inner sea, inward gravity, tide anchors and industrial pixel concept.",
      "purpose": "轮坠前内海穹的内向水体与潮钟连接基准。",
      "source_path": "project_reference/坠星余烬_当前设定与素材_2026-07-26/素材/萨迦/概念候选/区域/saga_inner_sea_dome_pre_rotation_v01.png",
      "status": "concept-candidate",
      "target_size": {
        "concept_aspect": "16:9 concept; not tileable",
        "height": 90,
        "width": 160
      },
      "variants": [
        "pre-rotation",
        "during-rotation",
        "post-rotation"
      ]
    },
    {
      "alpha_processing": "not-applicable",
      "audit": {
        "checks": [
          "palette",
          "no single down",
          "no text or UI",
          "bilateral readability"
        ],
        "conclusion": "approved-concept-candidate"
      },
      "id": "saga.no-down-city.pre-rotation",
      "kind": "environment",
      "location_id": "saga.no-down-city",
      "prohibited_integration_reason": "Concept composition only; requires pixel-grid reconstruction and engine asset acceptance.",
      "prompt": "Saga No-Down City before rotation; bilateral architecture and neutral gravity industrial cosmic pixel concept.",
      "purpose": "轮坠前无下城双向居住与中性重力基准。",
      "source_path": "project_reference/坠星余烬_当前设定与素材_2026-07-26/素材/萨迦/概念候选/区域/saga_no_down_city_pre_rotation_v01.png",
      "status": "concept-candidate",
      "target_size": {
        "concept_aspect": "16:9 concept; not tileable",
        "height": 90,
        "width": 160
      },
      "variants": [
        "pre-rotation",
        "during-rotation",
        "post-rotation"
      ]
    },
    {
      "alpha_processing": "not-applicable",
      "audit": {
        "checks": [
          "palette",
          "gravity direction",
          "no text or UI",
          "core support retained"
        ],
        "conclusion": "approved-concept-candidate"
      },
      "id": "saga.axis-pillar.pre-rotation",
      "kind": "environment",
      "location_id": "saga.axis-pillar",
      "prohibited_integration_reason": "Concept composition only; requires pixel-grid reconstruction and engine asset acceptance.",
      "prompt": "Saga Axis Pillar before rotation; protected load-bearing pillar, dormant rings and visible gravity streams.",
      "purpose": "轮坠前贯轴柱、断裂修缮与重力流走向基准。",
      "source_path": "project_reference/坠星余烬_当前设定与素材_2026-07-26/素材/萨迦/概念候选/区域/saga_axis_pillar_pre_rotation_v01.png",
      "status": "concept-candidate",
      "target_size": {
        "concept_aspect": "16:9 concept; not tileable",
        "height": 90,
        "width": 160
      },
      "variants": [
        "pre-rotation",
        "during-rotation",
        "post-rotation"
      ]
    },
    {
      "alpha_processing": "not-applicable",
      "audit": {
        "checks": [
          "palette",
          "core retained",
          "no text or UI",
          "mechanical silhouette"
        ],
        "conclusion": "approved-concept-candidate"
      },
      "id": "saga.dual-pivot-chamber.pre-rotation",
      "kind": "environment",
      "location_id": "saga.dual-pivot-chamber",
      "prohibited_integration_reason": "Concept composition only; requires pixel-grid reconstruction and engine asset acceptance.",
      "prompt": "Saga Dual Pivot Chamber before rotation; dormant counter-rotating rings around a sealed retained gravity core.",
      "purpose": "轮坠前双枢室、封存坠核与反向环结构基准。",
      "source_path": "project_reference/坠星余烬_当前设定与素材_2026-07-26/素材/萨迦/概念候选/区域/saga_dual_pivot_chamber_pre_rotation_v01.png",
      "status": "concept-candidate",
      "target_size": {
        "concept_aspect": "16:9 concept; not tileable",
        "height": 90,
        "width": 160
      },
      "variants": [
        "pre-rotation",
        "during-rotation",
        "post-rotation"
      ]
    },
    {
      "alpha_processing": "not-applicable",
      "audit": {
        "checks": [
          "palette",
          "revised gravity",
          "no text or UI",
          "maintenance not catastrophe"
        ],
        "conclusion": "approved-concept-candidate"
      },
      "id": "saga.outer-day-city.post-rotation",
      "kind": "environment",
      "location_id": "saga.outer-day-city",
      "prohibited_integration_reason": "Concept composition only; requires pixel-grid reconstruction and engine asset acceptance.",
      "prompt": "Saga Outer Day City after rotation; gravity flip survives through anchors, cargo rails and maintained orientation.",
      "purpose": "第一次轮坠后外昼城的可预测翻转与锚定维护基准。",
      "source_path": "project_reference/坠星余烬_当前设定与素材_2026-07-26/素材/萨迦/概念候选/区域/saga_outer_day_city_post_rotation_v01.png",
      "status": "concept-candidate",
      "target_size": {
        "concept_aspect": "16:9 concept; not tileable",
        "height": 90,
        "width": 160
      },
      "variants": [
        "pre-rotation",
        "during-rotation",
        "post-rotation"
      ]
    },
    {
      "alpha_processing": "not-applicable",
      "audit": {
        "checks": [
          "palette",
          "revised gravity",
          "no text or UI",
          "controlled water flow"
        ],
        "conclusion": "approved-concept-candidate"
      },
      "id": "saga.inner-sea-dome.post-rotation",
      "kind": "environment",
      "location_id": "saga.inner-sea-dome",
      "prohibited_integration_reason": "Concept composition only; requires pixel-grid reconstruction and engine asset acceptance.",
      "prompt": "Saga Inner Sea Dome after rotation; tide buffers route water under revised gravity with maintenance pressure.",
      "purpose": "第一次轮坠后内海穹潮汐缓冲与新方向基准。",
      "source_path": "project_reference/坠星余烬_当前设定与素材_2026-07-26/素材/萨迦/概念候选/区域/saga_inner_sea_dome_post_rotation_v01.png",
      "status": "concept-candidate",
      "target_size": {
        "concept_aspect": "16:9 concept; not tileable",
        "height": 90,
        "width": 160
      },
      "variants": [
        "pre-rotation",
        "during-rotation",
        "post-rotation"
      ]
    },
    {
      "alpha_processing": "not-applicable",
      "audit": {
        "checks": [
          "palette",
          "two orientations",
          "no text or UI",
          "ongoing maintenance"
        ],
        "conclusion": "approved-concept-candidate"
      },
      "id": "saga.no-down-city.post-rotation",
      "kind": "environment",
      "location_id": "saga.no-down-city",
      "prohibited_integration_reason": "Concept composition only; requires pixel-grid reconstruction and engine asset acceptance.",
      "prompt": "Saga No-Down City after rotation; two orientations coexist under symmetric tethered maintenance.",
      "purpose": "第一次轮坠后无下城两面适应与中和维护基准。",
      "source_path": "project_reference/坠星余烬_当前设定与素材_2026-07-26/素材/萨迦/概念候选/区域/saga_no_down_city_post_rotation_v01.png",
      "status": "concept-candidate",
      "target_size": {
        "concept_aspect": "16:9 concept; not tileable",
        "height": 90,
        "width": 160
      },
      "variants": [
        "pre-rotation",
        "during-rotation",
        "post-rotation"
      ]
    },
    {
      "alpha_processing": "not-applicable",
      "audit": {
        "checks": [
          "palette",
          "periodic gravity",
          "no text or UI",
          "pillar retained"
        ],
        "conclusion": "approved-concept-candidate"
      },
      "id": "saga.axis-pillar.post-rotation",
      "kind": "environment",
      "location_id": "saga.axis-pillar",
      "prohibited_integration_reason": "Concept composition only; requires pixel-grid reconstruction and engine asset acceptance.",
      "prompt": "Saga Axis Pillar after rotation; restored periodic gravity rhythm and maintained load-bearing structure.",
      "purpose": "第一次轮坠后贯轴柱恢复周期性坠律的基准。",
      "source_path": "project_reference/坠星余烬_当前设定与素材_2026-07-26/素材/萨迦/概念候选/区域/saga_axis_pillar_post_rotation_v01.png",
      "status": "concept-candidate",
      "target_size": {
        "concept_aspect": "16:9 concept; not tileable",
        "height": 90,
        "width": 160
      },
      "variants": [
        "pre-rotation",
        "during-rotation",
        "post-rotation"
      ]
    },
    {
      "alpha_processing": "not-applicable",
      "audit": {
        "checks": [
          "palette",
          "sealed core retained",
          "no text or UI",